### ISSUE TITLE
cursors/portals fails with node.js `pg` (due to premature `ReadyForQuery`) 

### ISSUE THREAD

**Issue by proddata** [crate/crate#13904]
### CrateDB version

5.2.5 (also in 4.6 / 4.7 / 4.3)

### Problem description

While testing `pg-cursor` and `pg-query-stream` I noticed that only the first fetching of data seems to work, and that any subsequent fetch would just return 0 results. This seems to be related, to CrateDB sending a `ReadyForQuery` and the `pg-cursor` module interpreting this as the end of the cursor.  (also see https://github.com/brianc/node-postgres/blob/65ca2458fd0079f36a99a7752a7931483cd57ed6/packages/pg-cursor/index.js#L143)

In PosgreSQL this works as intended 

### Steps to Reproduce

```
npm install pg pg-cursor
```

```js
const { Pool } = require('pg')
const Cursor = require('pg-cursor')

const pool = new Pool({
    host: 'localhost',
    user: 'crate',
    password: '',
    max: 1,
    idleTimeoutMillis: 30000,
    connectionTimeoutMillis: 2000,
    database: 'crate',
    ssl: false
})

main();

async function main() {
    const client = await pool.connect();
    const stmt = 'SELECT * FROM sys.summits';
    const cursor = client.query(new Cursor(stmt));

    let res1 = await cursor.read(5);
    let res2 = await cursor.read(10);
    let res3 = await cursor.read(10);
    console.log(res1.length,res2.length,res3.length);

    cursor.close();
    client.release();
};
```

### Actual Result

`5 0 0`

### Expected Result

`5 10 10`

**Comment by proddata** [comment]
**PostgreSQL**:
<img width="982" alt="image" src="https://user-images.githubusercontent.com/23557193/228879528-43fa450f-a421-4939-b724-487043858ac8.png">


**CrateDB**:
<img width="776" alt="image" src="https://user-images.githubusercontent.com/23557193/228880104-a02c0376-8617-4ef6-81b1-4e3619f70353.png">

```
113	2.309198	::1	::1	PGSQL	679	<D/D/D/D/D/s/Z
Frame 113: 679 bytes on wire (5432 bits), 679 bytes captured (5432 bits) on interface lo0, id 0
Null/Loopback
Internet Protocol Version 6, Src: ::1, Dst: ::1
Transmission Control Protocol, Src Port: 5432, Dst Port: 49671, Seq: 461, Ack: 140, Len: 603
PostgreSQL
    Type: Data row
    Length: 126
    Field count: 9
PostgreSQL
    Type: Data row
    Length: 117
    Field count: 9
PostgreSQL
    Type: Data row
    Length: 102
    Field count: 9
PostgreSQL
    Type: Data row
    Length: 122
    Field count: 9
PostgreSQL
    Type: Data row
    Length: 120
    Field count: 9
PostgreSQL
    Type: Portal suspended
    Length: 4
PostgreSQL
    Type: Ready for query
    Length: 5
    Status: Idle (73)
```

**Comment by matriv** [comment]
maybe relates to #13885

**Comment by matriv** [comment]
This is not using server-side cursors, there are no DECLARE/FETCH statements involved.
Those are client side cursors, sending normal parse/declare/bind/execute commands for the select query to the server, changing the title.

The issue is there of course, haven't figured out yet the cause, as CrateDB also sends the suspend message after the first result rows are sent, maybe somthing is out of order because of the delayed channel writes.

**Comment by mfussenegger** [comment]
Thanks for the report, should be fixed with https://github.com/crate/crate/pull/13911
